{
  "$schema": "http://json-schema.org/draft-07/schema#",
  "$id": "parlays.schema.json",
  "title": "Weekly and per-game parlays",
  "description": "Correlation-aware parlays with model EV and an ordinal (threshold-based, uncalibrated) confidence tier. Produced by scripts/models/parlay_builder.py (>=3 per game and >=3 per week), validated by scripts/validate_data.py.",
  "type": "object",
  "additionalProperties": false,
  "required": ["season", "week", "updated_utc", "parlays"],
  "properties": {
    "season": {
      "type": "integer",
      "minimum": 2026
    },
    "week": {
      "type": "integer",
      "minimum": 1,
      "maximum": 18
    },
    "updated_utc": { "type": "string" },
    "candidate_coverage": {
      "type": "object", "additionalProperties": false,
      "description": "Generation-bound live candidate coverage. A zero-prop game or tiny slate may offer fewer distinct cards, never duplicate filler. Not copied into mixed frozen archives.",
      "required": ["version", "generated_utc", "game_shortfalls", "week_shortfall"],
      "properties": {
        "version": {"type": "string", "enum": ["distinct_cards_v1"]},
        "generated_utc": {"type": "string", "minLength": 1},
        "game_shortfalls": {
          "type": "array", "items": {
            "type": "object", "additionalProperties": false,
            "required": ["game_id", "target", "candidate_prop_count", "raw_cards", "distinct_cards", "duplicates_removed", "shortfall", "reason"],
            "properties": {
              "game_id": {"type": "string", "minLength": 1},
              "target": {"type": "integer", "enum": [3]},
              "candidate_prop_count": {"type": "integer", "enum": [0]},
              "raw_cards": {"type": "integer", "enum": [3]},
              "distinct_cards": {"type": "integer", "minimum": 1, "maximum": 2},
              "duplicates_removed": {"type": "integer", "minimum": 1, "maximum": 2},
              "shortfall": {"type": "integer", "minimum": 1, "maximum": 2},
              "reason": {"type": "string", "enum": ["no_eligible_prop_candidates", "prop_inputs_not_supplied"]}
            }
          }
        },
        "week_shortfall": {
          "type": ["object", "null"], "additionalProperties": false,
          "required": ["target", "slate_games", "distinct_cards", "shortfall", "reason"],
          "properties": {
            "target": {"type": "integer", "enum": [3]},
            "slate_games": {"type": "integer", "minimum": 0, "maximum": 2},
            "distinct_cards": {"type": "integer", "minimum": 0, "maximum": 1},
            "shortfall": {"type": "integer", "minimum": 2, "maximum": 3},
            "reason": {"type": "string", "enum": ["insufficient_distinct_games"]}
          }
        }
      }
    },
    "parlays": {
      "type": "array",
      "items": {
        "type": "object",
        "additionalProperties": false,
        "required": [
          "parlay_id",
          "scope",
          "legs",
          "model_ev",
          "confidence_tier",
          "correlation_note"
        ],
        "properties": {
          "parlay_id": {
            "type": "string",
            "description": "Stable parlay identifier."
          },
          "scope": {
            "type": "string",
            "description": "'game' = same-game (correlation-critical); 'week' = cross-game.",
            "enum": ["game", "week"]
          },
          "game_id": {
            "type": "string",
            "description": "Present for scope='game' parlays; the game they attach to."
          },
          "legs": {
            "type": "array",
            "description": "Individual parlay legs.",
            "minItems": 1,
            "items": {
              "type": "object",
              "additionalProperties": false,
              "required": ["market", "selection", "implied_prob", "model_prob"],
              "properties": {
                "market": {
                  "type": "string",
                  "description": "Market type, e.g. 'moneyline', 'spread', 'total', 'anytime_td'."
                },
                "selection": {
                  "type": "string",
                  "description": "The specific pick within the market."
                },
                "side": {
                  "type": "string",
                  "enum": ["home", "away"],
                  "description": "Team side within the leg's event, preserved for correlation. Optional for legacy archives."
                },
                "price_source": {"type": "string", "enum": ["assumed", "fair_market", "book_quote", "unavailable"]},
                "implied_prob": {
                  "type": "number",
                  "description": "DISPLAY ONLY market column: the book's de-vigged probability for this exact selection when a real price was fetched, otherwise model_prob re-vigged by the standard hold (no book price exists for that leg). Never an input to anything we produce.",
                  "minimum": 0,
                  "maximum": 1
                },
                "model_prob": {
                  "type": "number",
                  "description": "OUR probability for this leg, computed without any market price (owner policy: market prices are display only). Moneyline = the game model's win probability; spread = exactly 0.5 at the book's handicap since R51 (the cover model measured below coin-flip on 2023-25 - see edge_note); props = the calibrated logistic on this week's projected yards (or the labelled seed fallback). A market's de-vigged probability may never appear here - a market with no model of ours yields no leg at all.",
                  "minimum": 0,
                  "maximum": 1
                },
                "edge_note": {
                  "type": "string",
                  "description": "Spread legs only (R51): states that the cover model measured no edge and the leg is priced flat at 0.5 until a margin model clears never-regress."
                },
                "pricing": {
                  "type": "string",
                  "description": "Prop legs only: 'calibrated' = sigmoid(a + b*z + c*(p_team-0.5)) with coefficients from data/parlay_backtest.json; 'seed' = the pre-R51 fallback (calibration file absent or position uncovered), always paired with estimate_note.",
                  "enum": ["calibrated", "seed"]
                },
                "estimate": {
                  "type": "boolean",
                  "description": "Prop legs: the line is a documented seed threshold, not a book line."
                },
                "estimate_note": {
                  "type": "string",
                  "description": "Prop legs priced by the seed fallback carry this note so the fallback is never silent."
                },
                "mu": {
                  "type": "number",
                  "description": "Prop legs: the player's projected yards this week (season component x weekly share)."
                },
                "sd": {
                  "type": "number",
                  "description": "Prop legs (calibrated): residual sd of yards for the position, from data/parlay_backtest.json."
                },
                "z": {
                  "type": "number",
                  "description": "Prop legs (calibrated): (mu - line) / sd."
                },
                "line": {
                  "type": "number",
                  "description": "Prop legs: the yardage line the leg is evaluated at."
                },
                "gsis_id": {
                  "type": "string",
                  "minLength": 1,
                  "description": "R77: prop legs, the player the leg is priced on (player_weekly.json id), so the this-week gate can be checked against his weekly row."
                },
                "availability": {
                  "type": "string",
                  "enum": ["QUESTIONABLE"],
                  "description": "R77: the one non-ACTIVE status a leg is priced WITH (owner rule: Q priced + labelled, D excluded). Every other status is gated out before pricing, so no other value can appear."
                }
              }
            }
          },
          "model_ev": {
            "type": "number",
            "description": "Model expected value of the parlay (edge vs implied odds)."
          },
          "confidence_tier": {
            "type": "string",
            "description": "Ordinal band from a HARD-CODED edge threshold, not a calibration: high >= 0.12, medium >= 0.04 on (combined model_prob - combined implied_prob) minus 0.01 per leg beyond two. Nothing about it is calibrated and it states NO coverage guarantee - scripts/harness/conformal.py plays no part in producing it. Read it as a ranking, never as a probability of covering.",
            "enum": ["high", "medium", "low"]
          },
          "correlation_note": {
            "type": "string",
            "description": "How leg correlation was handled (required, may be 'independent legs')."
          }
        }
      }
    }
  }
}
